[
  {
    "case_id": "81e657e1-d516-41cf-98aa-2a2642c3947e",
    "seq": 1,
    "kind": "case_created",
    "body": {
      "actor": "benchmark-host",
      "inputs": {
        "objective": "Migrate src/integration.py to SQLAlchemy 2.0.36. upsert_and_list must create its SQLite table, insert/update rows using bound parameters in one transaction, return plain dicts ordered by id, preserve prior rows across calls, accept an empty batch, and roll back the entire batch if a row violates NOT NULL. Keep the engine argument and function signature; use supported SQLAlchemy execution/result APIs and keep dependency pins."
      },
      "contract": [
        "githits-sqlalchemy-execute",
        1
      ]
    },
    "at": 1792048291978285,
    "previous": "0000000000000000000000000000000000000000000000000000000000000000",
    "hash": "1c3e86203b59ef8b504e4fae5a0f00219df2a2c230242c85aa71fbccdd1e0576"
  },
  {
    "case_id": "81e657e1-d516-41cf-98aa-2a2642c3947e",
    "seq": 2,
    "kind": "observed",
    "body": {
      "key": "base",
      "value": {
        "commit": "0a8170520369224072e48bfb2c6b275716a5dc95",
        "tree": "6e864a4c83830207983066f74dbffa1383d13645",
        "branch": "refs/heads/main"
      },
      "source": "git",
      "version": "0a8170520369224072e48bfb2c6b275716a5dc95",
      "actor": "syberlabs.host",
      "verified": true
    },
    "at": 1792048292092492,
    "previous": "1c3e86203b59ef8b504e4fae5a0f00219df2a2c230242c85aa71fbccdd1e0576",
    "hash": "63a55ba1906fdd4f4b9e9d78da713df45ce87baf84ca44839b433f69108177a6"
  },
  {
    "case_id": "81e657e1-d516-41cf-98aa-2a2642c3947e",
    "seq": 3,
    "kind": "observed",
    "body": {
      "key": "sources",
      "value": {
        "repository": {
          "paths": [
            "requirements.txt",
            "src"
          ]
        }
      },
      "source": "syberlabs.host",
      "version": "0a8170520369224072e48bfb2c6b275716a5dc95",
      "actor": "syberlabs.host",
      "verified": true
    },
    "at": 1792048292094494,
    "previous": "63a55ba1906fdd4f4b9e9d78da713df45ce87baf84ca44839b433f69108177a6",
    "hash": "69e9b08b1cb50a2a9882ec64244eb3e9a176b1ef917d97c22a00d85d9eaa42de"
  },
  {
    "case_id": "81e657e1-d516-41cf-98aa-2a2642c3947e",
    "seq": 4,
    "kind": "observed",
    "body": {
      "key": "context",
      "value": {
        "query": "Migrate src/integration.py to SQLAlchemy 2.0.36. upsert_and_list must create its SQLite table, insert/update rows using bound parameters in one transaction, return plain dicts ordered by id, preserve prior rows across calls, accept an empty batch, and roll back the entire batch if a row violates NOT NULL. Keep the engine argument and function signature; use supported SQLAlchemy execution/result APIs and keep dependency pins.",
        "digest": "42aa27423d3759af107645727cdc108b55a67e60f5881f8251e2f8f843a58e88",
        "entries": [
          {
            "path": "src/integration.py",
            "blob": "2fcd728525f582436364bf432415bf1cf88b5ccc",
            "lines": [
              1,
              8
            ],
            "bytes": 518,
            "reason": "match"
          },
          {
            "path": "requirements.txt",
            "blob": "206695d5e22fc75fb69b185f83ce4d371c051ea1",
            "lines": [
              1,
              13
            ],
            "bytes": 222,
            "reason": "match"
          }
        ]
      },
      "source": "syberlabs.host",
      "version": "0a8170520369224072e48bfb2c6b275716a5dc95",
      "actor": "syberlabs.host",
      "verified": true
    },
    "at": 1792048292552866,
    "previous": "69e9b08b1cb50a2a9882ec64244eb3e9a176b1ef917d97c22a00d85d9eaa42de",
    "hash": "3672e7a3f8ce8f113d155be7edede28012965b03286e337f57d554af9e3dc1ba"
  },
  {
    "case_id": "81e657e1-d516-41cf-98aa-2a2642c3947e",
    "seq": 5,
    "kind": "search_started",
    "body": {
      "id": "s1",
      "provider": {
        "name": "codex-repair",
        "revision": "gpt-6.1-sol"
      },
      "operators": [
        "patch"
      ],
      "budget": {
        "max_candidates": 2,
        "max_evaluations": 2,
        "max_seconds": 1200
      },
      "base": "0a8170520369224072e48bfb2c6b275716a5dc95",
      "context_digest": "42aa27423d3759af107645727cdc108b55a67e60f5881f8251e2f8f843a58e88",
      "actor": "syberlabs.host"
    },
    "at": 1792048292555373,
    "previous": "3672e7a3f8ce8f113d155be7edede28012965b03286e337f57d554af9e3dc1ba",
    "hash": "fbdd1662034f8d2d7d05fd62072eb0185f9cfbb7fd367f83093d658038544880"
  },
  {
    "case_id": "81e657e1-d516-41cf-98aa-2a2642c3947e",
    "seq": 6,
    "kind": "candidate_registered",
    "body": {
      "id": "c1",
      "commit": "4f3a4adc04fc296bdcd32e6fa93e39244b03ef67",
      "tree": "6e642e7fd7bf1ea84b65072d1640b0ec65809884",
      "base": "0a8170520369224072e48bfb2c6b275716a5dc95",
      "parents": [],
      "operator": "patch",
      "provider": {
        "name": "codex-repair",
        "revision": "gpt-6.1-sol"
      },
      "changed_paths": [
        "src/integration.py"
      ],
      "scope_violations": [],
      "limit_violations": [],
      "diff": {
        "digest": "a619eb32df55ff19d92e2a0811269aca2fc6e5c8ae5a8414fb8f1a719798c5ab",
        "bytes": 1274,
        "files": 1
      },
      "signal": {
        "rationale": "Wrap SQL statements with text() and convert mapping results to plain dictionaries while retaining bound parameters, ordering, and the single transaction that rolls back the batch on failure. The existing SQLAlchemy 2.0.36 dependency pin remains unchanged.",
        "model_usage": {
          "input_tokens": 12379,
          "output_tokens": 423,
          "cache_read_input_tokens": 0,
          "model": "gpt-6.1-sol",
          "stop_reason": "end_turn"
        }
      },
      "note": "Migrate integration execution and row conversion to SQLAlchemy 2 APIs.",
      "actor": "syberlabs.host"
    },
    "at": 1792048306506869,
    "previous": "fbdd1662034f8d2d7d05fd62072eb0185f9cfbb7fd367f83093d658038544880",
    "hash": "df0e76f50fdbe650305a7bcb76c5a54e7b2916257ccab8dd349158222676bdb1"
  },
  {
    "case_id": "81e657e1-d516-41cf-98aa-2a2642c3947e",
    "seq": 7,
    "kind": "candidate_evaluated",
    "body": {
      "candidate": "c1",
      "commit": "4f3a4adc04fc296bdcd32e6fa93e39244b03ef67",
      "tree": "6e642e7fd7bf1ea84b65072d1640b0ec65809884",
      "evaluator": "syberlabs.checks/1",
      "checks": [
        {
          "name": "behavior",
          "state": "passed",
          "exit_code": 0,
          "duration_ms": 390,
          "output_digest": "bc02917d91a8d90c645c07979363570a8383fbbef5477cfe0b19a5f01926e8cd",
          "output_tail": "...\r\n----------------------------------------------------------------------\r\nRan 3 tests in 0.016s\r\n\r\nOK\r\n"
        },
        {
          "name": "dependency_pin",
          "state": "passed",
          "exit_code": 0,
          "duration_ms": 109,
          "output_digest": "e3b0c44298fc1c149afbf4c8996fb92427ae41e4649b934ca495991b7852b855",
          "output_tail": ""
        }
      ],
      "actor": "syberlabs.host"
    },
    "at": 1792048307257136,
    "previous": "df0e76f50fdbe650305a7bcb76c5a54e7b2916257ccab8dd349158222676bdb1",
    "hash": "902c0c898a58ad159deed9afddde98852a2abbfd9bb83e4598a8165719dfc879"
  },
  {
    "case_id": "81e657e1-d516-41cf-98aa-2a2642c3947e",
    "seq": 8,
    "kind": "search_finished",
    "body": {
      "id": "s1",
      "stopped": "completed",
      "candidates": [
        "c1"
      ],
      "recommended": [
        "c1"
      ],
      "evaluations": 1,
      "elapsed_ms": 14703,
      "error": null,
      "actor": "syberlabs.host"
    },
    "at": 1792048307259648,
    "previous": "902c0c898a58ad159deed9afddde98852a2abbfd9bb83e4598a8165719dfc879",
    "hash": "88a34965e5f992530258c0de9a802b9360972c58b26d367f38faf62265513cc5"
  }
]
